{
  "schema_version": 1,
  "case_id": "static_mesh_seed_a",
  "skeleton": "skeleton.json",
  "atlas": "skeleton.atlas",
  "page_manifest": "page_manifest.json",
  "source_attachments": "source_attachments",
  "observations": [
    {
      "id": "obs_000",
      "animation": "05_MagicAttack",
      "time": 0.5,
      "before": "observations/obs_000/before.png",
      "after": "observations/obs_000/after.png"
    },
    {
      "id": "obs_001",
      "animation": "01_Dance2",
      "time": 1.1,
      "before": "observations/obs_001/before.png",
      "after": "observations/obs_001/after.png"
    },
    {
      "id": "obs_002",
      "animation": "00_Walk",
      "time": 0.4,
      "before": "observations/obs_002/before.png",
      "after": "observations/obs_002/after.png"
    },
    {
      "id": "obs_003",
      "animation": "01_Dance2",
      "time": 1.0,
      "before": "observations/obs_003/before.png",
      "after": "observations/obs_003/after.png"
    },
    {
      "id": "obs_004",
      "animation": "05_MagicAttack",
      "time": 0.7,
      "before": "observations/obs_004/before.png",
      "after": "observations/obs_004/after.png"
    },
    {
      "id": "obs_005",
      "animation": "01_Dance2",
      "time": 1.2,
      "before": "observations/obs_005/before.png",
      "after": "observations/obs_005/after.png"
    }
  ],
  "viewport": {
    "x": -1300.0,
    "y": -650.0,
    "width": 2450.0,
    "height": 1900.0
  },
  "render_size": {
    "width": 768,
    "height": 596
  },
  "output_pages": [
    {
      "name": "page_000.png",
      "width": 498,
      "height": 718
    },
    {
      "name": "page_001.png",
      "width": 498,
      "height": 718
    },
    {
      "name": "page_002.png",
      "width": 563,
      "height": 498
    },
    {
      "name": "page_003.png",
      "width": 498,
      "height": 718
    },
    {
      "name": "page_004.png",
      "width": 498,
      "height": 718
    },
    {
      "name": "page_005.png",
      "width": 498,
      "height": 718
    },
    {
      "name": "page_006.png",
      "width": 498,
      "height": 718
    },
    {
      "name": "page_007.png",
      "width": 790,
      "height": 580
    },
    {
      "name": "page_008.png",
      "width": 790,
      "height": 580
    },
    {
      "name": "page_009.png",
      "width": 790,
      "height": 580
    },
    {
      "name": "page_010.png",
      "width": 790,
      "height": 580
    },
    {
      "name": "page_011.png",
      "width": 498,
      "height": 718
    },
    {
      "name": "page_012.png",
      "width": 498,
      "height": 718
    },
    {
      "name": "page_013.png",
      "width": 1230,
      "height": 622
    },
    {
      "name": "page_014.png",
      "width": 622,
      "height": 1230
    },
    {
      "name": "page_015.png",
      "width": 622,
      "height": 1230
    },
    {
      "name": "page_016.png",
      "width": 1230,
      "height": 622
    },
    {
      "name": "page_017.png",
      "width": 498,
      "height": 718
    },
    {
      "name": "page_018.png",
      "width": 998,
      "height": 850
    },
    {
      "name": "page_019.png",
      "width": 545,
      "height": 648
    }
  ]
}